{
  "status": "success",
  "plan_id": 1,
  "scene_id": "s5p-no2",
  "diagnostics": {
    "summary": "Scaffold execution with exporter planning."
  },
  "exports": [
    {
      "format": "netcdf_cf",
      "artifact_uri": "file://outputs/s5p-no2.nc",
      "plugin_id": "builtin.netcdf_cf",
      "media_type": "application/x-netcdf",
      "dataset_name": "s5p_no2_window",
      "includes_provenance": true
    }
  ],
  "provenance": {
    "model_family": "disamar_standard",
    "solver_route": "transport.dispatcher",
    "transport_family": "adding",
    "derivative_mode": "none",
    "numerical_mode": "polarized",
    "plugin_versions": [
      "builtin.netcdf_cf@0.1.0"
    ],
    "dataset_hashes": [
      "sha256:example-cross-sections"
    ]
  }
}
